Enter password: ****
Welcome to the MySQL monitor.  Commands end with ; or \g.
Your MySQL connection id is 14
Server version: 8.0.33 MySQL Community Server - GPL

Copyright (c) 2000, 2023, Oracle and/or its affiliates.

Oracle is a registered trademark of Oracle Corporation and/or its
affiliates. Other names may be trademarks of their respective
owners.

Type 'help;' or '\h' for help. Type '\c' to clear the current input statement.

mysql> create database wd7;
Query OK, 1 row affected (0.01 sec)

mysql> use wd7;
Database changed
mysql> create table restra(sn int primary key, name varchar(100),bill float);
Query OK, 0 rows affected (0.02 sec)

mysql> insert into restra values(1,"Krishna",32.43),(2,"Mohan",325.32),(3,"Sohan",656.32),(4,"Anamika",43.32);
Query OK, 4 rows affected (0.01 sec)
Records: 4  Duplicates: 0  Warnings: 0

mysql> select * from restra;
+----+---------+--------+
| sn | name    | bill   |
+----+---------+--------+
|  1 | Krishna |  32.43 |
|  2 | Mohan   | 325.32 |
|  3 | Sohan   | 656.32 |
|  4 | Anamika |  43.32 |
+----+---------+--------+
4 rows in set (0.00 sec)

mysql> alter table restra add total_bill float;
Query OK, 0 rows affected (0.01 sec)
Records: 0  Duplicates: 0  Warnings: 0

mysql> select * from restra;
+----+---------+--------+------------+
| sn | name    | bill   | total_bill |
+----+---------+--------+------------+
|  1 | Krishna |  32.43 |       NULL |
|  2 | Mohan   | 325.32 |       NULL |
|  3 | Sohan   | 656.32 |       NULL |
|  4 | Anamika |  43.32 |       NULL |
+----+---------+--------+------------+
4 rows in set (0.00 sec)

mysql> insert into restra(total_bill) values(bill+bill*0.18);
ERROR 1364 (HY000): Field 'sn' doesn't have a default value
mysql> update table set total_bill= bill+bill*0.18;
ERROR 1064 (42000): You have an error in your SQL syntax; check the manual that corresponds to your MySQL server version for the right syntax to use near 'table set total_bill= bill+bill*0.18' at line 1
mysql> update set total_bill= bill+bill*0.18;
ERROR 1064 (42000): You have an error in your SQL syntax; check the manual that corresponds to your MySQL server version for the right syntax to use near 'set total_bill= bill+bill*0.18' at line 1
mysql> select bill+bill*0.18 from restra;
+--------------------+
| bill+bill*0.18     |
+--------------------+
|  38.26740036010742 |
| 383.87760864257814 |
|  774.4576086425782 |
| 51.117599639892575 |
+--------------------+
4 rows in set (0.00 sec)

mysql> select bill+bill*0.18 as total_bill_gst from restra;
+--------------------+
| total_bill_gst     |
+--------------------+
|  38.26740036010742 |
| 383.87760864257814 |
|  774.4576086425782 |
| 51.117599639892575 |
+--------------------+
4 rows in set (0.00 sec)

mysql> alter table restra add total_bill_gst where total_bill_gst in(select bill+bill*0.18 from restra);
ERROR 1064 (42000): You have an error in your SQL syntax; check the manual that corresponds to your MySQL server version for the right syntax to use near 'where total_bill_gst in(select bill+bill*0.18 from restra)' at line 1
mysql> update restra set total_bill= bill+bill*0.18;
Query OK, 4 rows affected (0.01 sec)
Rows matched: 4  Changed: 4  Warnings: 0

mysql> select * from restra;
+----+---------+--------+------------+
| sn | name    | bill   | total_bill |
+----+---------+--------+------------+
|  1 | Krishna |  32.43 |    38.2674 |
|  2 | Mohan   | 325.32 |    383.878 |
|  3 | Sohan   | 656.32 |    774.458 |
|  4 | Anamika |  43.32 |    51.1176 |
+----+---------+--------+------------+
4 rows in set (0.00 sec)

mysql> select 32.43+32.43*18
    -> ;
+----------------+
| 32.43+32.43*18 |
+----------------+
|         616.17 |
+----------------+
1 row in set (0.00 sec)

mysql> select 32.43*0.18;
+------------+
| 32.43*0.18 |
+------------+
|     5.8374 |
+------------+
1 row in set (0.00 sec)

mysql> select 32.43+5.8374;
+--------------+
| 32.43+5.8374 |
+--------------+
|      38.2674 |
+--------------+
1 row in set (0.00 sec)

mysql> select * from restra;
+----+---------+--------+------------+
| sn | name    | bill   | total_bill |
+----+---------+--------+------------+
|  1 | Krishna |  32.43 |    38.2674 |
|  2 | Mohan   | 325.32 |    383.878 |
|  3 | Sohan   | 656.32 |    774.458 |
|  4 | Anamika |  43.32 |    51.1176 |
+----+---------+--------+------------+
4 rows in set (0.00 sec)

mysql> alter table restra drop total_bill;
Query OK, 0 rows affected (0.01 sec)
Records: 0  Duplicates: 0  Warnings: 0

mysql> select * from restra;
+----+---------+--------+
| sn | name    | bill   |
+----+---------+--------+
|  1 | Krishna |  32.43 |
|  2 | Mohan   | 325.32 |
|  3 | Sohan   | 656.32 |
|  4 | Anamika |  43.32 |
+----+---------+--------+
4 rows in set (0.00 sec)

mysql> delete from restra where sn=1;
Query OK, 1 row affected (0.01 sec)

mysql> select * from restra;
+----+---------+--------+
| sn | name    | bill   |
+----+---------+--------+
|  2 | Mohan   | 325.32 |
|  3 | Sohan   | 656.32 |
|  4 | Anamika |  43.32 |
+----+---------+--------+
3 rows in set (0.00 sec)

mysql> insert into restra values(1,"krishna",100);
Query OK, 1 row affected (0.00 sec)

mysql> select * from restra;
+----+---------+--------+
| sn | name    | bill   |
+----+---------+--------+
|  1 | krishna |    100 |
|  2 | Mohan   | 325.32 |
|  3 | Sohan   | 656.32 |
|  4 | Anamika |  43.32 |
+----+---------+--------+
4 rows in set (0.00 sec)

mysql> alter table restra add GST float;
Query OK, 0 rows affected (0.02 sec)
Records: 0  Duplicates: 0  Warnings: 0

mysql> select * from restra;
+----+---------+--------+------+
| sn | name    | bill   | GST  |
+----+---------+--------+------+
|  1 | krishna |    100 | NULL |
|  2 | Mohan   | 325.32 | NULL |
|  3 | Sohan   | 656.32 | NULL |
|  4 | Anamika |  43.32 | NULL |
+----+---------+--------+------+
4 rows in set (0.00 sec)

mysql> update restra set gst=bill+bill*0.18;
Query OK, 4 rows affected (0.00 sec)
Rows matched: 4  Changed: 4  Warnings: 0

mysql> select * from restra;
+----+---------+--------+---------+
| sn | name    | bill   | GST     |
+----+---------+--------+---------+
|  1 | krishna |    100 |     118 |
|  2 | Mohan   | 325.32 | 383.878 |
|  3 | Sohan   | 656.32 | 774.458 |
|  4 | Anamika |  43.32 | 51.1176 |
+----+---------+--------+---------+
4 rows in set (0.00 sec)

mysql> alter table restra modify GST Total_bill int;
ERROR 1064 (42000): You have an error in your SQL syntax; check the manual that corresponds to your MySQL server version for the right syntax to use near 'Total_bill int' at line 1
mysql> alter table restra modify GST Total_bill;
ERROR 1064 (42000): You have an error in your SQL syntax; check the manual that corresponds to your MySQL server version for the right syntax to use near 'Total_bill' at line 1
mysql> alter table restra modify column GST Total_bill int;
ERROR 1064 (42000): You have an error in your SQL syntax; check the manual that corresponds to your MySQL server version for the right syntax to use near 'Total_bill int' at line 1
mysql> alter table restra modify column GST Total_bill;
ERROR 1064 (42000): You have an error in your SQL syntax; check the manual that corresponds to your MySQL server version for the right syntax to use near 'Total_bill' at line 1
mysql> alter table restra modify column GST int;
Query OK, 4 rows affected (0.04 sec)
Records: 4  Duplicates: 0  Warnings: 0

mysql> select * from restra;
+----+---------+--------+------+
| sn | name    | bill   | GST  |
+----+---------+--------+------+
|  1 | krishna |    100 |  118 |
|  2 | Mohan   | 325.32 |  384 |
|  3 | Sohan   | 656.32 |  774 |
|  4 | Anamika |  43.32 |   51 |
+----+---------+--------+------+
4 rows in set (0.00 sec)

mysql> create table college(enrollment int primary key, name varchar(50) not null,branch varchar(30) not null);
Query OK, 0 rows affected (0.03 sec)

mysql> create table hostel(enroll int, room int);
Query OK, 0 rows affected (0.02 sec)

mysql> insert into college values(1,"krishna","MCA"),(2,"Mohan","BCA"),(3,"Sohan","BBA");
Query OK, 3 rows affected (0.03 sec)
Records: 3  Duplicates: 0  Warnings: 0

mysql> select * from college;
+------------+---------+--------+
| enrollment | name    | branch |
+------------+---------+--------+
|          1 | krishna | MCA    |
|          2 | Mohan   | BCA    |
|          3 | Sohan   | BBA    |
+------------+---------+--------+
3 rows in set (0.00 sec)

mysql> insert into hostel values(1,202),(2,202),(10,204),(10,205);
Query OK, 4 rows affected (0.01 sec)
Records: 4  Duplicates: 0  Warnings: 0

mysql> select * from hostel;
+--------+------+
| enroll | room |
+--------+------+
|      1 |  202 |
|      2 |  202 |
|     10 |  204 |
|     10 |  205 |
+--------+------+
4 rows in set (0.00 sec)

mysql> select * from college inner join hostel on college.enrollment=hostel.enroll;
+------------+---------+--------+--------+------+
| enrollment | name    | branch | enroll | room |
+------------+---------+--------+--------+------+
|          1 | krishna | MCA    |      1 |  202 |
|          2 | Mohan   | BCA    |      2 |  202 |
+------------+---------+--------+--------+------+
2 rows in set (0.00 sec)

mysql> select college.enrollment,college.name,college.branch, hostel.room from college inner join hostel on college.enrollment=hostel.enroll;
+------------+---------+--------+------+
| enrollment | name    | branch | room |
+------------+---------+--------+------+
|          1 | krishna | MCA    |  202 |
|          2 | Mohan   | BCA    |  202 |
+------------+---------+--------+------+
2 rows in set (0.00 sec)

mysql> select c.enrollment,c.name,c.branch, h.room from college as c inner join hostel as h on c.enrollment=h.enroll;
+------------+---------+--------+------+
| enrollment | name    | branch | room |
+------------+---------+--------+------+
|          1 | krishna | MCA    |  202 |
|          2 | Mohan   | BCA    |  202 |
+------------+---------+--------+------+
2 rows in set (0.00 sec)

mysql> select c.enrollment,c.name,c.branch, h.room from college as c left join hostel as h on c.enrollment=h.enroll;
+------------+---------+--------+------+
| enrollment | name    | branch | room |
+------------+---------+--------+------+
|          1 | krishna | MCA    |  202 |
|          2 | Mohan   | BCA    |  202 |
|          3 | Sohan   | BBA    | NULL |
+------------+---------+--------+------+
3 rows in set (0.00 sec)

mysql> select * from hostel;
+--------+------+
| enroll | room |
+--------+------+
|      1 |  202 |
|      2 |  202 |
|     10 |  204 |
|     10 |  205 |
+--------+------+
4 rows in set (0.00 sec)

mysql> select c.enrollment,c.name,c.branch, h.room from college as c right join hostel as h on c.enrollment=h.enroll;
+------------+---------+--------+------+
| enrollment | name    | branch | room |
+------------+---------+--------+------+
|          1 | krishna | MCA    |  202 |
|          2 | Mohan   | BCA    |  202 |
|       NULL | NULL    | NULL   |  204 |
|       NULL | NULL    | NULL   |  205 |
+------------+---------+--------+------+
4 rows in set (0.00 sec)

mysql> select c.enrollment,c.name,c.branch, h.room from college as c right join hostel as h on c.enrollment=h.enroll union select c.enrollment,c.name,c.branch,h.room,from college as c left join hostel as h on c.enrollment=h.enroll;
ERROR 1064 (42000): You have an error in your SQL syntax; check the manual that corresponds to your MySQL server version for the right syntax to use near 'from college as c left join hostel as h on c.enrollment=h.enroll' at line 1
mysql> select c.enrollment,c.name,c.branch, h.room from college as c right join hostel as h on c.enrollment=h.enroll union select c.enrollment,c.name,c.branch,h.room from college as c left join hostel as h on c.enrollment=h.enroll;
+------------+---------+--------+------+
| enrollment | name    | branch | room |
+------------+---------+--------+------+
|          1 | krishna | MCA    |  202 |
|          2 | Mohan   | BCA    |  202 |
|       NULL | NULL    | NULL   |  204 |
|       NULL | NULL    | NULL   |  205 |
|          3 | Sohan   | BBA    | NULL |
+------------+---------+--------+------+
5 rows in set (0.00 sec)

mysql>